{
  "id": "block.usbc_dual_orientation_data",
  "desc": "USB-C 设备口(16P)双取向数据 tie:DP1+DP2(A6+B6)短接成 USB_DP、DM1+DM2(A7+B7)短接成 USB_DM,C 口正反插都能通信;CC1/CC2 各 5.1K 下拉广告 UFP/设备(sink);D+/D- 各挂一颗 ESD5311 对地;VBUS/GND 冗余焊盘 fanout 全并联。区别于 usbc_ufp_power_or(仅电源 OR),本块只做数据+CC。",
  "category": "usb",
  "author": "@zhoushoujianwork",
  "contributors": [
    "M5Stack StickS3 K150 (原理图对标来源)"
  ],
  "added": "v0.19.0",
  "updated": "v0.19.0",
  "source": "oshwhub-ref:M5Stack StickS3 K150 原理图 PDF V0.6 20251111 (page_03)",
  "validated": "ceshi 2026-07-23 by @zhoushoujianwork: block-apply 孤立单放 reconciled + bridge-check 0/0/0 + pin-audit 0/0(真机 --probe 符号脚核实)。schematic 档 passed;PCB/bringup 待整板。",
  "verification": {
    "schematic": {
      "status": "passed",
      "evidence": "ceshi 2026-07-23 sch block-apply 孤立单放:9 条 internal_net 全落地(reconciled:true,0 空 members)+ bridge-check 0 桥/0 孤儿桩/0 孤儿flag + blocks-pin-audit 引脚对真实符号脚 0 fanout/0 missing。孤立单放下模组多余 GPIO/连接器未用脚显示 floating=预期(块只接支撑电路)。诚实:pcb_drc/bringup 未跑,production_ready=false;非整板环境验证。"
    },
    "component_selection": {
      "status": "passed",
      "evidence": "deviceUuid/LCSC/footprint 已由 easyeda lib search + by-lcsc 对 ceshi 库解析写回 standard-parts.json(2026-07-23);全库覆盖率 100%。个别封装/变体存疑处(见 standard-parts desc caveat)待 block-apply 核对"
    },
    "pcb_drc": {
      "status": "pending"
    },
    "bringup": {
      "status": "pending"
    },
    "production_ready": false
  },
  "parts": {
    "J": {
      "part": "conn.usb_c_16p",
      "qty": 1,
      "note": "USB-C 16P 连接器(已在标准库)。双取向数据 tie:A 面 DP1/DN1 与 B 面 DP2/DN2 短接,正反插都通(原理图 M5 符号把 D- 标 DM1/DM2、屏蔽标 SHELL;本库 conn.usb_c_16p 符号实测脚名为 DN1/DN2、EP,已按库名绑定,佐证见已验证块 usbc_ufp_power_or)。VBUS(A4/B9+B4/A9)、GND(A1/A12+B1/B12)+EP 屏蔽壳为冗余焊盘,放置前用 sch read/--probe 再核对。SBU1/SBU2 本板悬空。"
    },
    "R_CC1": {
      "part": "res.5k1_0402",
      "qty": 1,
      "note": "CC1 下拉 5.1K 到地(R3):UFP/设备 sink 广告,向 host 请求取电。绝不上拉(上拉=source/DFP)。"
    },
    "R_CC2": {
      "part": "res.5k1_0402",
      "qty": 1,
      "note": "CC2 下拉 5.1K 到地(R4):与 R_CC1 成对,保证正反插任一取向都有 5.1K sink 广告。"
    },
    "D_DP": {
      "part": "esd.esd5311",
      "qty": 1,
      "note": "D+ 数据线 ESD 保护(D2 ESD5311),另一端接 GND,靠近 USB-C 连接器放置。"
    },
    "D_DM": {
      "part": "esd.esd5311",
      "qty": 1,
      "note": "D- 数据线 ESD 保护(D1 ESD5311),另一端接 GND,靠近 USB-C 连接器放置。"
    }
  },
  "internal_nets": [
    [
      "J.VBUS*",
      "PORT:VBUS"
    ],
    [
      "J.GND*",
      "J.EP*",
      "PORT:GND"
    ],
    [
      "J.DP1",
      "J.DP2",
      "D_DP.1",
      "PORT:USB_DP"
    ],
    [
      "J.DN1",
      "J.DN2",
      "D_DM.1",
      "PORT:USB_DM"
    ],
    [
      "J.CC1",
      "R_CC1.1",
      "PORT:CC1"
    ],
    [
      "R_CC1.2",
      "PORT:GND"
    ],
    [
      "J.CC2",
      "R_CC2.1",
      "PORT:CC2"
    ],
    [
      "R_CC2.2",
      "PORT:GND"
    ],
    [
      "D_DP.2",
      "D_DM.2",
      "PORT:GND"
    ]
  ],
  "ports": {
    "VBUS": {
      "dir": "bidir",
      "at": "J.VBUS*",
      "desc": "5V 总线电源:所有冗余 VBUS 焊盘(A4/B9 + B4/A9)fanout 全并联,接系统电源前端/负载开关",
      "default_net": "VBUS"
    },
    "GND": {
      "dir": "bidir",
      "at": "J.GND*",
      "desc": "地:所有 GND 焊盘(A1/A12 + B1/B12)+ EP 屏蔽壳(原理图 M5 符号标 SHELL)fanout 全并联,CC 下拉与数据 ESD 也回此地",
      "default_net": "GND"
    },
    "USB_DP": {
      "dir": "bidir",
      "at": "J.DP1",
      "desc": "USB 数据 D+:DP1(A6)+DP2(B6)双取向 tie 后引出,经 ESD5311 对地;接 MCU 原生 USB 或 USB-Serial 桥的 D+",
      "default_net": "USB_DP"
    },
    "USB_DM": {
      "dir": "bidir",
      "at": "J.DN1",
      "desc": "USB 数据 D-:DN1(A7)+DN2(B7,原理图 M5 符号标 DM1/DM2)双取向 tie 后引出,经 ESD5311 对地;接 MCU 原生 USB 或 USB-Serial 桥的 D-",
      "default_net": "USB_DM"
    },
    "CC1": {
      "dir": "bidir",
      "at": "J.CC1",
      "desc": "配置通道 1:块内已 5.1K 下拉到地(UFP/设备 sink);host 侧上拉与本块下拉分压做取向/角色检测",
      "default_net": "CC1"
    },
    "CC2": {
      "dir": "bidir",
      "at": "J.CC2",
      "desc": "配置通道 2:块内已 5.1K 下拉到地,与 CC1 成对支撑正反插取向检测",
      "default_net": "CC2"
    }
  },
  "schematic_notes": [
    "双取向 tie 是正解(硬订正):DP1(A6)与 DP2(B6)短接成一根 USB_DP,DN1(A7)与 DN2(B7)短接成一根 USB_DM(原理图 M5 符号把这两脚标 DM1/DM2,本库符号名为 DN1/DN2)——这样 C 口正反插都能通信。此前库里「单取向省略 B6/B7」是权宜之计,官方板(N8R8 / StickS3)一致用双取向 tie。",
    "5.1K CC 下拉 = UFP/设备(sink):CC1、CC2 各经 5.1K 到地,向 host 广告本设备取电;绝不上拉,上拉表示 source/DFP 会导致角色协商错误。两根都要下拉,保证任一插入取向都有 sink 广告。",
    "数据线 ESD:D+/D- 各挂一颗 ESD5311 对地,靠近 USB-C 连接器放置,泄放静电冲击。ESD 器件的接地端(D_DP.2 / D_DM.2)与 CC 下拉、SHELL 一起回 GND。",
    "VBUS 与 GND 冗余焊盘用 fanout(功能名带 * 号)全并联:VBUS 的多个焊盘(A4/B9 + B4/A9)并成一根 VBUS 网,GND 的多个焊盘(A1/A12 + B1/B12)与外壳 SHELL 并成一根 GND 网,降低阻抗、分担电流。",
    "SBU1/SBU2 本板悬空;SHELL 金属外壳接 GND。",
    "本块只做数据 + CC:VBUS 的二极管 OR / 防倒灌电源路径见 usbc_ufp_power_or,两块可组合成完整 USB-C 设备口。",
    "netflag 必须经真实导线连到脚:重叠脚坐标不算连接,DRC 看不到(EasyEDA 硬规则)。",
    "引脚名核对:本库 conn.usb_c_16p 符号功能脚名(据已验证块 usbc_ufp_power_or 的 sch read + 网表对账)为 VBUS/GND/CC1/CC2/DP1/DP2/DN1/DN2/SBU1/SBU2/EP;StickS3 原理图 M5 符号把 D- 标 DM1/DM2、屏蔽标 SHELL——已按本库脚名(DN1/DN2、EP)绑定,升 verified 前用 --probe 再确认。"
  ],
  "pcb_layout": [
    {
      "rule": "esd-adjacency",
      "target": "D_DP / D_DM",
      "constraint": "ESD5311 紧贴 USB-C 连接器 D+/D- 焊盘放置,ESD 到连接器的走线最短,泄放路径直接入地平面",
      "value": "<=3mm",
      "severity": "must"
    },
    {
      "rule": "diff-pair",
      "target": "USB_DP / USB_DM",
      "constraint": "D+/D- 作差分对走线,等长、平行、间距一致,目标 90Ω 差分阻抗;双取向 tie 的两段(A6↔B6、A7↔B7)短接点靠近连接器,tie 走线尽量短且对称",
      "value": "90Ω, 等长",
      "severity": "must"
    },
    {
      "rule": "cc-pulldown-short",
      "target": "R_CC1 / R_CC2",
      "constraint": "5.1K CC 下拉靠近连接器 CC 焊盘,下拉到就近地",
      "value": "",
      "severity": "should"
    },
    {
      "rule": "shell-to-gnd",
      "target": "J shell/mount pads",
      "constraint": "USB-C 金属外壳/固定脚多点缝合到地平面,抗插拔机械应力与 ESD",
      "value": "",
      "severity": "should"
    }
  ],
  "placement": {
    "J": {
      "board_edge": true,
      "edge": "user-facing",
      "side": "top",
      "orientation": "USB-C 口开口朝板外便于插拔,连接器本体可略突出板框(Type-C 常见做法);双取向 tie 使正反插无差别",
      "severity": "must",
      "reason": "USB-C 需插拔,连接器必须在板边、开口朝外"
    }
  },
  "signals": {
    "_doc": "USB 高速差分对 + CC 配置通道,数据线带 ESD。",
    "USB_DATA": {
      "nets": [
        "USB_DP",
        "USB_DM"
      ],
      "type": "diff_pair",
      "route": "D+/D- 差分等长、90Ω,先过 ESD 再入连接器;双取向 tie 短接点靠近连接器,tie 段对称",
      "keepout": "远离开关电源 SW/LX 与 RF/天线",
      "severity": "must",
      "reason": "USB 差分对,阻抗/等长失配或近开关噪声会误码"
    },
    "CC": {
      "nets": [
        "CC1",
        "CC2"
      ],
      "type": "single_low_speed",
      "route": "短走线到 5.1K 下拉,靠近连接器",
      "keepout": "无特殊",
      "severity": "should",
      "reason": "CC 是低速取向/角色检测线,布线要求不高"
    }
  },
  "silk": {
    "J": {
      "label": "USB-C / TYPE-C",
      "clearance": "outside-body — 连接器本体外侧",
      "severity": "should"
    }
  },
  "bom_note": "5 件:1× USB-C 16P 连接器(conn.usb_c_16p)+ 2× 5.1K 0402(CC1/CC2 下拉,UFP/设备 sink)+ 2× ESD5311(D+/D- 数据线 ESD)。双取向数据 tie(A6+B6 / A7+B7)是官方板正解;本块只做数据+CC,VBUS 电源 OR/防倒灌见 usbc_ufp_power_or。"
}
